{
  "$schema": "https://json-schema.org/draft/2020-12/schema",
  "$id": "https://letzscan.lu/schemas/geography-set.schema.json",
  "type": "object",
  "properties": {
    "id": {
      "type": "string",
      "minLength": 1,
      "maxLength": 128,
      "pattern": "^[a-z0-9][a-z0-9._:-]*$"
    },
    "title": {
      "type": "string",
      "minLength": 1
    },
    "level": {
      "type": "string",
      "enum": [
        "country",
        "district",
        "canton",
        "commune",
        "quarter",
        "locality"
      ]
    },
    "code_scheme": {
      "type": "string",
      "minLength": 1
    },
    "source_id": {
      "type": "string",
      "minLength": 1,
      "maxLength": 128,
      "pattern": "^[a-z0-9][a-z0-9._:-]*$"
    },
    "valid_from": {
      "type": "string",
      "format": "date",
      "pattern": "^(?:(?:\\d\\d[2468][048]|\\d\\d[13579][26]|\\d\\d0[48]|[02468][048]00|[13579][26]00)-02-29|\\d{4}-(?:(?:0[13578]|1[02])-(?:0[1-9]|[12]\\d|3[01])|(?:0[469]|11)-(?:0[1-9]|[12]\\d|30)|(?:02)-(?:0[1-9]|1\\d|2[0-8])))$"
    },
    "valid_to": {
      "type": "string",
      "format": "date",
      "pattern": "^(?:(?:\\d\\d[2468][048]|\\d\\d[13579][26]|\\d\\d0[48]|[02468][048]00|[13579][26]00)-02-29|\\d{4}-(?:(?:0[13578]|1[02])-(?:0[1-9]|[12]\\d|3[01])|(?:0[469]|11)-(?:0[1-9]|[12]\\d|30)|(?:02)-(?:0[1-9]|1\\d|2[0-8])))$"
    },
    "description": {
      "type": "string"
    },
    "supersedes": {
      "default": [],
      "type": "array",
      "items": {
        "type": "string",
        "minLength": 1,
        "maxLength": 128,
        "pattern": "^[a-z0-9][a-z0-9._:-]*$"
      }
    },
    "members": {
      "default": [],
      "type": "array",
      "items": {
        "$ref": "#/$defs/Geography"
      }
    }
  },
  "required": [
    "id",
    "title",
    "level",
    "code_scheme",
    "source_id",
    "valid_from"
  ],
  "title": "GeographySet",
  "description": "A versioned family of geographies plus its crosswalk lineage.",
  "$defs": {
    "Geography": {
      "type": "object",
      "properties": {
        "id": {
          "type": "string",
          "minLength": 1,
          "maxLength": 128,
          "pattern": "^[a-z0-9][a-z0-9._:-]*$"
        },
        "set_id": {
          "type": "string",
          "minLength": 1,
          "maxLength": 128,
          "pattern": "^[a-z0-9][a-z0-9._:-]*$"
        },
        "code": {
          "type": "string",
          "minLength": 1
        },
        "name": {
          "type": "string",
          "minLength": 1
        },
        "level": {
          "type": "string",
          "enum": [
            "country",
            "district",
            "canton",
            "commune",
            "quarter",
            "locality"
          ]
        },
        "parent_id": {
          "type": "string",
          "minLength": 1,
          "maxLength": 128,
          "pattern": "^[a-z0-9][a-z0-9._:-]*$"
        },
        "valid_from": {
          "type": "string",
          "format": "date",
          "pattern": "^(?:(?:\\d\\d[2468][048]|\\d\\d[13579][26]|\\d\\d0[48]|[02468][048]00|[13579][26]00)-02-29|\\d{4}-(?:(?:0[13578]|1[02])-(?:0[1-9]|[12]\\d|3[01])|(?:0[469]|11)-(?:0[1-9]|[12]\\d|30)|(?:02)-(?:0[1-9]|1\\d|2[0-8])))$"
        },
        "valid_to": {
          "type": "string",
          "format": "date",
          "pattern": "^(?:(?:\\d\\d[2468][048]|\\d\\d[13579][26]|\\d\\d0[48]|[02468][048]00|[13579][26]00)-02-29|\\d{4}-(?:(?:0[13578]|1[02])-(?:0[1-9]|[12]\\d|3[01])|(?:0[469]|11)-(?:0[1-9]|[12]\\d|30)|(?:02)-(?:0[1-9]|1\\d|2[0-8])))$"
        }
      },
      "required": [
        "id",
        "set_id",
        "code",
        "name",
        "level",
        "valid_from"
      ],
      "title": "Geography",
      "description": "A single place in a single boundary version."
    }
  }
}
