{
  "code_scheme": "LAU",
  "description": "The 100 Luxembourg communes in force since 1 September 2023, keyed by their LAU 2 code. `members` is empty on purpose: the gazetteer is produced by the pipeline from an authoritative source and published as an artifact, not hand-maintained here.\n`valid_from` is the producer's own effective date, not an assumption. STATEC's LAU code register (A1106.xlsx, sheet \"LU_SEP 2023\") states it verbatim as \"codes UAL au 01.09.2023 (100 communes)\". It is corroborated by the two acts that produced the current set, both of which say in their Article 13 \"La présente loi entre en vigueur le 1er septembre 2023\":\n  - Loi du 3 mars 2023 portant fusion des communes de Grosbous et de Wahl,\n    creating « Groussbus-Wal » (LAU 0711)\n    https://legilux.public.lu/eli/etat/leg/loi/2023/03/03/a115/jo\n  - Loi du 3 mars 2023 portant fusion des communes de Bous et de Waldbredimus,\n    creating « Bous-Waldbredimus » (LAU 1209)\n    https://legilux.public.lu/eli/etat/leg/loi/2023/03/03/a117/jo\n\nThe code space is the national LAU scheme: two digits of canton (LAU 1) plus two of commune, zero-padded. The codes carried by the statec-lustat dataflow were checked on 2026-08-19 to be exactly the 100 codes in STATEC's LAU register, so statistical series join to this set on code without a crosswalk.\nCommune boundary *geometry* is deliberately absent. This set declares the code space only; choosing a geometry producer is a separate decision recorded in docs/adr/0007-commune-geography-authority.md.",
  "id": "lu-communes",
  "level": "commune",
  "members": [
    {
      "code": "0101",
      "id": "lu.commune.0101",
      "level": "commune",
      "name": "Dippach",
      "set_id": "lu-communes",
      "valid_from": "2023-09-01"
    },
    {
      "code": "0102",
      "id": "lu.commune.0102",
      "level": "commune",
      "name": "Garnich",
      "set_id": "lu-communes",
      "valid_from": "2023-09-01"
    },
    {
      "code": "0103",
      "id": "lu.commune.0103",
      "level": "commune",
      "name": "Habscht",
      "set_id": "lu-communes",
      "valid_from": "2023-09-01"
    },
    {
      "code": "0104",
      "id": "lu.commune.0104",
      "level": "commune",
      "name": "Käerjeng",
      "set_id": "lu-communes",
      "valid_from": "2023-09-01"
    },
    {
      "code": "0105",
      "id": "lu.commune.0105",
      "level": "commune",
      "name": "Kehlen",
      "set_id": "lu-communes",
      "valid_from": "2023-09-01"
    },
    {
      "code": "0106",
      "id": "lu.commune.0106",
      "level": "commune",
      "name": "Koerich",
      "set_id": "lu-communes",
      "valid_from": "2023-09-01"
    },
    {
      "code": "0107",
      "id": "lu.commune.0107",
      "level": "commune",
      "name": "Kopstal",
      "set_id": "lu-communes",
      "valid_from": "2023-09-01"
    },
    {
      "code": "0108",
      "id": "lu.commune.0108",
      "level": "commune",
      "name": "Mamer",
      "set_id": "lu-communes",
      "valid_from": "2023-09-01"
    },
    {
      "code": "0110",
      "id": "lu.commune.0110",
      "level": "commune",
      "name": "Steinfort",
      "set_id": "lu-communes",
      "valid_from": "2023-09-01"
    },
    {
      "code": "0201",
      "id": "lu.commune.0201",
      "level": "commune",
      "name": "Bettembourg",
      "set_id": "lu-communes",
      "valid_from": "2023-09-01"
    },
    {
      "code": "0202",
      "id": "lu.commune.0202",
      "level": "commune",
      "name": "Differdange",
      "set_id": "lu-communes",
      "valid_from": "2023-09-01"
    },
    {
      "code": "0203",
      "id": "lu.commune.0203",
      "level": "commune",
      "name": "Dudelange",
      "set_id": "lu-communes",
      "valid_from": "2023-09-01"
    },
    {
      "code": "0204",
      "id": "lu.commune.0204",
      "level": "commune",
      "name": "Esch-sur-Alzette",
      "set_id": "lu-communes",
      "valid_from": "2023-09-01"
    },
    {
      "code": "0205",
      "id": "lu.commune.0205",
      "level": "commune",
      "name": "Frisange",
      "set_id": "lu-communes",
      "valid_from": "2023-09-01"
    },
    {
      "code": "0206",
      "id": "lu.commune.0206",
      "level": "commune",
      "name": "Kayl",
      "set_id": "lu-communes",
      "valid_from": "2023-09-01"
    },
    {
      "code": "0207",
      "id": "lu.commune.0207",
      "level": "commune",
      "name": "Leudelange",
      "set_id": "lu-communes",
      "valid_from": "2023-09-01"
    },
    {
      "code": "0208",
      "id": "lu.commune.0208",
      "level": "commune",
      "name": "Mondercange",
      "set_id": "lu-communes",
      "valid_from": "2023-09-01"
    },
    {
      "code": "0209",
      "id": "lu.commune.0209",
      "level": "commune",
      "name": "Pétange",
      "set_id": "lu-communes",
      "valid_from": "2023-09-01"
    },
    {
      "code": "0210",
      "id": "lu.commune.0210",
      "level": "commune",
      "name": "Reckange-sur-Mess",
      "set_id": "lu-communes",
      "valid_from": "2023-09-01"
    },
    {
      "code": "0211",
      "id": "lu.commune.0211",
      "level": "commune",
      "name": "Roeser",
      "set_id": "lu-communes",
      "valid_from": "2023-09-01"
    },
    {
      "code": "0212",
      "id": "lu.commune.0212",
      "level": "commune",
      "name": "Rumelange",
      "set_id": "lu-communes",
      "valid_from": "2023-09-01"
    },
    {
      "code": "0213",
      "id": "lu.commune.0213",
      "level": "commune",
      "name": "Sanem",
      "set_id": "lu-communes",
      "valid_from": "2023-09-01"
    },
    {
      "code": "0214",
      "id": "lu.commune.0214",
      "level": "commune",
      "name": "Schifflange",
      "set_id": "lu-communes",
      "valid_from": "2023-09-01"
    },
    {
      "code": "0301",
      "id": "lu.commune.0301",
      "level": "commune",
      "name": "Bertrange",
      "set_id": "lu-communes",
      "valid_from": "2023-09-01"
    },
    {
      "code": "0302",
      "id": "lu.commune.0302",
      "level": "commune",
      "name": "Contern",
      "set_id": "lu-communes",
      "valid_from": "2023-09-01"
    },
    {
      "code": "0303",
      "id": "lu.commune.0303",
      "level": "commune",
      "name": "Hesperange",
      "set_id": "lu-communes",
      "valid_from": "2023-09-01"
    },
    {
      "code": "0304",
      "id": "lu.commune.0304",
      "level": "commune",
      "name": "Luxembourg",
      "set_id": "lu-communes",
      "valid_from": "2023-09-01"
    },
    {
      "code": "0305",
      "id": "lu.commune.0305",
      "level": "commune",
      "name": "Niederanven",
      "set_id": "lu-communes",
      "valid_from": "2023-09-01"
    },
    {
      "code": "0306",
      "id": "lu.commune.0306",
      "level": "commune",
      "name": "Sandweiler",
      "set_id": "lu-communes",
      "valid_from": "2023-09-01"
    },
    {
      "code": "0307",
      "id": "lu.commune.0307",
      "level": "commune",
      "name": "Schuttrange",
      "set_id": "lu-communes",
      "valid_from": "2023-09-01"
    },
    {
      "code": "0308",
      "id": "lu.commune.0308",
      "level": "commune",
      "name": "Steinsel",
      "set_id": "lu-communes",
      "valid_from": "2023-09-01"
    },
    {
      "code": "0309",
      "id": "lu.commune.0309",
      "level": "commune",
      "name": "Strassen",
      "set_id": "lu-communes",
      "valid_from": "2023-09-01"
    },
    {
      "code": "0310",
      "id": "lu.commune.0310",
      "level": "commune",
      "name": "Walferdange",
      "set_id": "lu-communes",
      "valid_from": "2023-09-01"
    },
    {
      "code": "0311",
      "id": "lu.commune.0311",
      "level": "commune",
      "name": "Weiler-la-Tour",
      "set_id": "lu-communes",
      "valid_from": "2023-09-01"
    },
    {
      "code": "0401",
      "id": "lu.commune.0401",
      "level": "commune",
      "name": "Colmar-Berg",
      "set_id": "lu-communes",
      "valid_from": "2023-09-01"
    },
    {
      "code": "0402",
      "id": "lu.commune.0402",
      "level": "commune",
      "name": "Bissen",
      "set_id": "lu-communes",
      "valid_from": "2023-09-01"
    },
    {
      "code": "0403",
      "id": "lu.commune.0403",
      "level": "commune",
      "name": "Helperknapp",
      "set_id": "lu-communes",
      "valid_from": "2023-09-01"
    },
    {
      "code": "0404",
      "id": "lu.commune.0404",
      "level": "commune",
      "name": "Fischbach",
      "set_id": "lu-communes",
      "valid_from": "2023-09-01"
    },
    {
      "code": "0405",
      "id": "lu.commune.0405",
      "level": "commune",
      "name": "Heffingen",
      "set_id": "lu-communes",
      "valid_from": "2023-09-01"
    },
    {
      "code": "0406",
      "id": "lu.commune.0406",
      "level": "commune",
      "name": "Larochette",
      "set_id": "lu-communes",
      "valid_from": "2023-09-01"
    },
    {
      "code": "0407",
      "id": "lu.commune.0407",
      "level": "commune",
      "name": "Lintgen",
      "set_id": "lu-communes",
      "valid_from": "2023-09-01"
    },
    {
      "code": "0408",
      "id": "lu.commune.0408",
      "level": "commune",
      "name": "Lorentzweiler",
      "set_id": "lu-communes",
      "valid_from": "2023-09-01"
    },
    {
      "code": "0409",
      "id": "lu.commune.0409",
      "level": "commune",
      "name": "Mersch",
      "set_id": "lu-communes",
      "valid_from": "2023-09-01"
    },
    {
      "code": "0410",
      "id": "lu.commune.0410",
      "level": "commune",
      "name": "Nommern",
      "set_id": "lu-communes",
      "valid_from": "2023-09-01"
    },
    {
      "code": "0501",
      "id": "lu.commune.0501",
      "level": "commune",
      "name": "Clervaux",
      "set_id": "lu-communes",
      "valid_from": "2023-09-01"
    },
    {
      "code": "0502",
      "id": "lu.commune.0502",
      "level": "commune",
      "name": "Wincrange",
      "set_id": "lu-communes",